select conn_num from backends where backend_ndx = 1 and user = "root";
connection_num
1
use test;
set @a=3;
SELECT data from user where id = @a;
data
wb
use test;
set @a=4;
SELECT data from user where id = @a;
data
lazio
use test;
set @a=2;
SELECT data from user where id = @a;
data
jyywb
use test;
set @a=3;
SELECT data from user where id = @a;
data
wb
use test;
set @a=2;
SELECT data from user where id = @a;
data
jyywb
select conn_num from backends where backend_ndx = 1 and user = "root";
connection_num
6
delete from backends where backend_ndx = 1;
use test;
set @a=3;
SELECT data from user where id = @a;
data
wb
select conn_num from backends where backend_ndx = 1 and user = "root";
connection_num
6
use test;
set @a=4;
SELECT data from user where id = @a;
data
lazio
use test;
set @a=5;
SELECT data from user where id = @a;
data
select conn_num from backends where backend_ndx = 1 and user = "root";
connection_num
6
use test;
set @a=4;
SELECT data from user where id = @a;
data
use test;
set @a=4;
SELECT data from user where id = @a;
data
use test;
set @a=5;
SELECT data from user where id = @a;
data
use test;
set @a=5;
SELECT data from user where id = @a;
data
use test;
set @a=5;
SELECT data from user where id = @a;
data
use test;
set @a=5;
SELECT data from user where id = @a;
data
use test;
set @a=5;
SELECT data from user where id = @a;
data
use test;
update test set data="wbjyywb" where id = 5;
ERROR 07000: 2, master connections are too small
select conn_num from backends where backend_ndx = 1 and user = "root";
connection_num
6
