select conn_num from backends where backend_ndx = 1 and user = "root";
connection_num
1
select conn_num from backends where backend_ndx = 1 and user = "root";
connection_num
6
begin;
update user set data="Hello world" where id = 1;
update user set data="jyywb" where id = 2;
commit;
select conn_num from backends where backend_ndx = 1 and user = "root";
connection_num
6
begin;
SELECT data from user where id = 2;
data
jyywb
update user set data="jyywb2" where id = 2;
rollback;
select conn_num from backends where backend_ndx = 1 and user = "root";
connection_num
6
SELECT data from user where id = 2;
data
jyywb
select conn_num from backends where backend_ndx = 1 and user = "root";
connection_num
6
begin;
SELECT data from user where id = 4;
data
lazio
rollback;
select conn_num from backends where backend_ndx = 1 and user = "root";
connection_num
6
begin;
SELECT data from user where id = 5;
data
select conn_num from backends where backend_ndx = 1 and user = "root";
connection_num
6
begin;
SELECT data from user where id = 6;
data
wb
begin;
SELECT data from user where id = 7;
data
jyy
begin;
SELECT data from user where id = 8;
data
lazio
begin;
SELECT data from user where id = 9;
data
wb
begin;
SELECT data from user where id = 10;
data
dog
begin;
SELECT data from user where id = 11;
data
lazio
begin;
SELECT data from user where id = 12;
data
begin;
SELECT data from user where id = 13;
data
begin;
SELECT data from user where id = 14;
data
begin;
SELECT data from user where id = 15;
data
select conn_num from backends where backend_ndx = 1 and user = "root";
connection_num
5
select conn_num from backends where backend_ndx = 2 and user = "root";
connection_num
0
rollback;
rollback;
rollback;
rollback;
rollback;
rollback;
rollback;
rollback;
rollback;
rollback;
rollback;
select conn_num from backends where backend_ndx = 1 and user = "root";
connection_num
16
select conn_num from backends where backend_ndx = 2 and user = "root";
connection_num
0
