select conn_num from backends where backend_ndx = 1 and user = "root";
connection_num
1
update user set data="Hello world" where id = 1;
update user set data="jyywb" where id = 2;
SELECT data from user where id = 2;
data
jyywb
SELECT data from user where id = 3;
data
wb
SELECT data from user where id = 4;
data
lazio
SELECT data from user where id = 5;
data
SELECT data from user where id = 6;
data
wb
SELECT data from user where id = 7;
data
jyy
SELECT data from user where id = 8;
data
lazio
SELECT data from user where id = 9;
data
wb
SELECT data from user where id = 10;
data
dog
select conn_num from backends where backend_ndx = 1 and user = "root";
connection_num
0
select conn_num from backends where backend_ndx = 2 and user = "root";
connection_num
0
update backends set state = "maintaining" where backend_ndx = 2;
SELECT data from user where id = 11;
data
lazio
SELECT data from user where id = 2;
ERROR 07000: 1,master connections are too small
select conn_num from backends where backend_ndx = 1 and user = "root";
connection_num
1
select conn_num from backends where backend_ndx = 2 and user = "root";
connection_num
0
SELECT data from user where id = 2;
data
jyywb
select conn_num from backends where backend_ndx = 1 and user = "root";
connection_num
0
select conn_num from backends where backend_ndx = 2 and user = "root";
connection_num
0
